Name,Difficulty,Summary,Reasoning
Lying Machine Squat,Intermediate,Leg squat performed using a machine.,"Targets the quads, machine provides stability and control."
Seated Leg Curl,Intermediate,Hamstring exercise performed on a seated leg curl machine.,"Isolates the hamstrings, seated position focuses on muscle contraction."
Standing Barbell Press Behind Neck,Advanced,Shoulder press with a barbell performed behind the neck.,"Challenges shoulder mobility and strength, advanced technique."
Close-Grip EZ-Bar Curl with Band,Intermediate,Bicep curl using an EZ-bar with added resistance from a band.,"Targets the biceps, band adds extra resistance."
Alternating Kettlebell Row,Intermediate,Back exercise involving alternating rows with a kettlebell.,"Strengthens the back, alternating rows challenge stability."
Single-arm side lying rear fly,Intermediate,"Shoulder exercise focusing on the rear deltoids, performed lying down.","Isolates the rear deltoids, lying position increases focus."
Cable shrug,Intermediate,Upper back exercise involving shrugs with a cable machine.,"Targets the upper traps, cable adds constant tension."
Pallof press with rotation,Intermediate,Core exercise involving a press and rotational movement with a cable.,"Strengthens core with added rotational movement, increases difficulty."
Lying T-Bar Row,Intermediate,Back exercise using a T-bar row machine while lying down.,"Targets the back, lying position focuses on muscle engagement."
Band Good Morning,Intermediate,Lower back exercise performed with resistance bands.,"Strengthens the lower back, bands provide resistance."
Kneeling lat pull-down,Intermediate,Lat pull-down exercise performed in a kneeling position.,"Strengthens the lats, kneeling position alters the pull angle."
Standing Bent-Over One-Arm Dumbbell Triceps Extension,Intermediate,"Triceps extension with a dumbbell, performed one arm at a time.","Isolates the triceps, one-arm focus increases intensity."
Overhead squat,Advanced,Full-body squat exercise performed with a barbell overhead.,"Challenges full-body stability and strength, requires advanced technique."
Pistol squat,Advanced,"One-legged squat, requires balance and strength.","Requires balance and leg strength, advanced single-leg exercise."
Single-Leg Leg Extension,Intermediate,Leg extension focusing on one leg at a time.,"Isolates the quadriceps, single-leg focus increases difficulty."
Lateral Raise - With Bands,Intermediate,Shoulder exercise performed with lateral raises using bands.,"Strengthens the shoulders, bands add resistance."
Leverage High Row,Advanced,Back exercise using a high row machine.,"Targets the upper back, machine adds stability."
Medicine ball slam,Intermediate,Full-body exercise involving slamming a medicine ball.,"Improves full-body power, requires coordination and strength."
Single-arm dumbbell upright row,Intermediate,Shoulder exercise focusing on upright rows with a dumbbell.,"Targets the shoulders, single-arm focus increases difficulty."
Smith machine behind-the-back shrug,Intermediate,Upper back exercise involving shrugs on a Smith machine.,"Strengthens the upper traps, Smith machine adds stability."
Leg-Up Hamstring Stretch,Beginner,Stretching exercise focusing on the hamstrings.,"Improves hamstring flexibility, suitable for all levels."
Walking High Knees,Beginner,Cardiovascular exercise involving high knee movements while walking.,"Increases heart rate, good for cardiovascular health."
Kettlebell pirate ship,Intermediate,Kettlebell exercise mimicking a rowing movement.,"Develops back and arm strength, requires coordination."
Dumbbell Scaption,Intermediate,Shoulder exercise involving dumbbell raises at an angle.,"Targets the shoulders, scaption angle adds difficulty."
Cable Wrist Curl,Intermediate,Forearm exercise using a cable machine for wrist curls.,"Strengthens the wrists and forearms, cable adds resistance."
Upright Row - With Bands,Intermediate,"Shoulder exercise with resistance bands, mimicking an upright row.","Targets the shoulders, bands add resistance."
Suspended Reverse Crunch,Intermediate,Core exercise using a suspension trainer for reverse crunches.,"Strengthens the core, suspension adds instability."
Lateral lunge,Intermediate,Lower body exercise involving lateral lunges.,"Targets the legs, lateral movement adds variation."
Close-Hands Push-Up,Intermediate,Push-up variation with hands placed close together.,"Strengthens the chest and triceps, close hand placement increases difficulty."
Exercise ball hip thrust,Intermediate,Glute-focused exercise using an exercise ball for hip thrusts.,"Targets the glutes, exercise ball adds instability."
Barbell side split squat,Advanced,Leg exercise involving a squat with a side split.,"Challenges leg strength and balance, advanced squat variation."
See-Saw Press (Alternating Side Press),Intermediate,Shoulder press performed by alternating sides.,"Targets the shoulders, alternating movement adds difficulty."
Sumo Deadlift with Chains,Advanced,Deadlift variation using chains for added resistance.,"Increases deadlift intensity, chains add variable resistance."
Frog Sit-Ups,Intermediate,Abdominal exercise involving a frog-like leg movement.,"Targets the abs, frog leg movement increases difficulty."
Kettlebell Windmill,Advanced,Kettlebell exercise focusing on flexibility and core stability.,"Develops core strength and flexibility, kettlebell adds challenge."
Seated Leg Press,Intermediate,Leg press exercise performed on a seated machine.,"Targets the legs, machine provides stability."
Straight-arm plank with biceps curl,Advanced,Core and arm exercise combining a plank with biceps curls.,"Combines core stability with arm strength, challenging balance."
Cable Deadlifts,Intermediate,Deadlift exercise using a cable machine for resistance.,"Targets the legs and back, cable adds consistent resistance."
Board bench press,Advanced,Chest press performed with a board for partial range of motion.,"Develops chest strength, board limits range for focused effort."
Frankenstein Squat,Intermediate,Squat variation mimicking the movement of Frankenstein's monster.,"Targets the legs, unique squat variation increases difficulty."
Cable Seated Crunch,Intermediate,Abdominal exercise using a cable machine for seated crunches.,"Targets the abs, cable adds resistance."
Kettlebell Figure 8,Intermediate,Kettlebell exercise involving a figure-eight movement.,"Challenges coordination and core strength, kettlebell adds difficulty."
Kettlebell Curtsy Lunge,Intermediate,Lower body exercise combining a lunge and a curtsy motion with a kettlebell.,"Develops leg strength and balance, curtsy motion adds difficulty."
Single Leg Butt Kick,Intermediate,Cardio exercise involving a single-leg butt kick motion.,"Improves cardiovascular fitness, focuses on leg movement."
Lying bench reverse crunch,Intermediate,Core exercise focusing on reverse crunches while lying on a bench.,"Strengthens the core, lying position focuses on reverse crunches."
Side Leg Raises,Beginner,Leg exercise focusing on lateral leg raises.,"Targets the outer thigh and glutes, suitable for beginners."
Smith machine Bulgarian split squat,Intermediate,Leg squat variation performed on one leg using a Smith machine.,"Challenges balance and leg strength, Smith machine adds stability."
Barbell speed squat,Intermediate,Squat exercise emphasizing speed and explosiveness.,"Develops leg power, focuses on speed and explosiveness."
Circus Bell,Advanced,Full-body kettlebell exercise focusing on stability and strength.,"Challenges full-body stability and strength, advanced kettlebell movement."
Suspended row,Intermediate,Upper body row exercise performed in a suspended position.,"Strengthens the upper back, suspension adds instability."
Incline Bench Pull,Intermediate,"Back exercise performed on an incline bench, targeting upper back.","Targets the upper back, incline position increases intensity."
Around The Worlds,Intermediate,Shoulder mobility exercise performed with dumbbells in a circular motion.,"Improves shoulder mobility, circular motion adds complexity."
Tiger-bend push-up,Advanced,Advanced push-up variation with an emphasis on triceps.,"Increases triceps strength, advanced push-up variation."
Face-down incline dumbbell biceps curl,Intermediate,Bicep curl performed face-down on an incline bench with dumbbells.,"Isolates the biceps, incline position intensifies the exercise."
Kneeling Jump Squat,Intermediate,Lower body exercise focusing on explosive squat jumps from a kneeling position.,"Develops explosive leg power, kneeling start adds difficulty."
Jump Squat,Intermediate,Explosive squat exercise focusing on jumping power.,"Improves lower body power, requires coordination and strength."
Seated Head Harness Neck Resistance,Beginner,Neck strengthening exercise performed seated with a head harness.,"Strengthens the neck muscles, head harness adds resistance."
Shoulder Press - With Bands,Intermediate,Shoulder press performed with resistance bands.,"Strengthens shoulders, bands add variable resistance."
Band-assisted pull-up,Beginner,Pull-up exercise assisted by bands to reduce intensity.,"Assists with pull-ups, suitable for beginners."
Barbell Bench Press-Wide Grip,Intermediate,Wide grip variation of the barbell bench press.,"Targets the chest, wide grip focuses on the outer chest."
Barbell Seated Calf Raise,Intermediate,Seated calf raise exercise performed with a barbell.,"Strengthens the calves, seated position focuses on calf raise."
Over bench jump,Intermediate,Plyometric exercise involving jumping over a bench.,"Develops leg power and agility, requires coordination."
Single-arm side deadlift,Intermediate,"Deadlift variation performed with one arm, focusing on the side.","Challenges core and back, single-arm focus adds difficulty."
Sit-up,Beginner,Core exercise focusing on traditional sit-ups.,"Strengthens the core, traditional sit-up exercise."
Side Bridge,Intermediate,Core exercise focusing on maintaining a side plank position.,"Strengthens the core, side plank focuses on obliques."
Two-Arm Kettlebell Clean,Intermediate,Kettlebell exercise involving a clean movement with both arms.,"Develops arm and shoulder strength, kettlebell adds challenge."
Zottman Preacher Curl,Intermediate,Bicep curl performed on a preacher bench with a unique grip.,"Targets the biceps, Zottman grip adds variation."
Balance Board,Intermediate,Balance and stability exercise performed on a balance board.,"Improves balance and coordination, suitable for all levels."
Split Jump,Intermediate,Plyometric exercise focusing on split leg jumps.,"Develops leg power and coordination, split jump adds complexity."
Plyo push-up,Intermediate,Plyometric push-up variation focusing on explosive power.,"Enhances upper body power, plyometric movement adds intensity."
Inchworm,Intermediate,Full-body exercise involving walking hands forward and back.,"Improves core strength and flexibility, full-body movement."
Cable rope preacher hammer curl,Intermediate,Bicep curl performed on a preacher bench with a cable rope.,"Isolates the biceps, preacher bench and cable add intensity."
Vertical Swing,Advanced,Explosive lower body movement swinging a weight vertically.,"Develops lower body power, requires coordination and strength."
Seated Bent-Over One-Arm Dumbbell Triceps Extension,Intermediate,"Triceps extension performed seated, focusing on one arm.","Isolates the triceps, seated position adds stability."
Double Kettlebell Push Press,Advanced,Shoulder press performed with double kettlebells.,"Challenges shoulder strength and stability, kettlebells add difficulty."
Lying oblique crunch,Intermediate,Core exercise focusing on oblique muscles while lying down.,"Targets obliques, lying position focuses on side muscles."
Barbell front raise,Intermediate,Shoulder exercise performing front raises with a barbell.,"Strengthens shoulders, barbell front raise challenges stability."
Weighted donkey calf raise,Advanced,"Calf raise exercise mimicking a donkey kick, using added weight.","Targets the calves, weighted movement adds intensity."
Machine Triceps Extension,Intermediate,Triceps exercise performed on a machine.,"Targets the triceps, machine provides consistent resistance."
Janda Sit-Up,Advanced,Advanced sit-up variation emphasizing lower abdominal strength.,"Strengthens abs, requires control and muscle activation."
Sled push-,Advanced,Full-body exercise involving pushing a weighted sled.,"Builds full-body strength and endurance, sled adds resistance."
Seated Dumbbell Inner Biceps Curl,Intermediate,"Bicep curl performed seated, focusing on the inner biceps.","Targets inner biceps, seated position isolates the muscle."
Close-grip hands-elevated push-up,Intermediate,Push-up variation with close grip and elevated hands.,"Strengthens chest and triceps, elevated hands increase intensity."
Barbell Squat To A Bench,Intermediate,"Squat performed to a bench, focusing on form and depth.","Improves squat technique, bench guides depth and form."
Dumbbell Incline Shoulder Raise,Intermediate,Shoulder raise performed on an incline bench with dumbbells.,"Targets the shoulders, incline position increases difficulty."
Standing Inner-Biceps Curl,Intermediate,"Bicep curl performed standing, focusing on the inner biceps.","Isolates inner biceps, standing position adds stability."
Single-arm kettlebell swing,Intermediate,Kettlebell swing performed with one arm.,"Develops coordination and power, single-arm swing adds difficulty."
Pull Through,Intermediate,Glute and hamstring exercise involving pulling through the legs.,"Strengthens glutes and hamstrings, pull-through movement adds challenge."
Leg Pull-In,Intermediate,Core exercise involving pulling the legs in while lying down.,"Targets the core, leg pull-in focuses on lower abs."
Standing Leg Curl,Intermediate,Leg curl exercise performed in a standing position.,"Strengthens hamstrings, standing position challenges stability."
Isometric Neck Exercise - Sides,Intermediate,Neck strengthening exercise focusing on the sides.,"Strengthens neck muscles, focuses on the sides."
Lying cable chest fly,Intermediate,Chest fly exercise performed lying down with a cable.,"Targets the chest, cable fly adds constant tension."
Single-arm pull-down,Intermediate,Lat pull-down performed with one arm.,"Strengthens lats, single-arm pull-down isolates muscles."
Side Jackknife,Intermediate,Core exercise involving a side crunch movement.,"Targets obliques, side jackknife adds intensity."
Dumbbell Walking Lunge,Intermediate,Leg exercise involving lunges while walking.,"Improves leg strength and endurance, walking lunge adds movement."
Lateral hop,Intermediate,Lower body exercise focusing on lateral movement and agility.,"Improves agility and coordination, suitable for all levels."
Suspended push-up,Advanced,Advanced push-up variation with hands suspended.,"Challenges upper body strength and stability, advanced technique."
Two-Arm Kettlebell Row,Intermediate,Back exercise targeting both sides using a kettlebell.,"Targets the back muscles, kettlebell adds intensity."
One Arm Floor Press,Intermediate,Upper body press focusing on one arm at a time.,"Strengthens one arm at a time, focuses on chest and triceps."
Kettlebell Pass Between The Legs,Intermediate,Lower body exercise passing a kettlebell between the legs.,"Targets lower body, passing kettlebell adds coordination challenge."
Wide-Grip Decline Barbell Pullover,Intermediate,Chest exercise involving a wide-grip pullover on a decline bench.,"Targets the chest, wide grip and decline angle increase intensity."
Feet-elevated crunch,Intermediate,Core exercise focusing on crunches with feet elevated.,"Strengthens the core, elevated feet add difficulty."
Smith machine upright row,Intermediate,Shoulder exercise using a Smith machine for upright rows.,"Targets the shoulders, Smith machine adds stability."
Smith Machine Decline Press,Intermediate,Chest press performed on a decline bench using a Smith machine.,"Targets the chest, decline angle focuses on lower chest."
Smith Machine Reverse Calf Raises,Intermediate,Calf exercise focusing on reverse movements using a Smith machine.,"Strengthens the calves, reverse movement adds variation."
Moving Claw Series,Advanced,Upper body movement series targeting hand and finger strength.,"Enhances finger and hand strength, complex movement series."
Single-dumbbell push-up,Advanced,Push-up variation with an added challenge using a single dumbbell.,"Increases push-up difficulty, single dumbbell adds instability."
Front Cone Hops (or hurdle hops),Intermediate,Lower body agility exercise involving hopping over cones or hurdles.,"Develops agility and leg power, requires coordination."
Overhead bar front raise,Intermediate,Shoulder exercise focusing on raising a bar overhead.,"Strengthens the shoulders, overhead movement adds difficulty."
Single-arm Smith machine upright row,Intermediate,Single-arm row targeting the back using a Smith machine.,"Targets the back, single-arm row adds intensity."
Weighted Squat,Intermediate,Leg exercise emphasizing squat movement with added weight.,"Strengthens the legs, added weight increases difficulty."
Dumbbell Seated One-Leg Calf Raise,Intermediate,"Calf raise focusing on one leg, performed while seated with a dumbbell.","Targets the calves, single-leg focus increases intensity."
Cable Incline Pushdown,Intermediate,Triceps exercise focusing on incline pushdowns using a cable.,"Targets the triceps, incline angle adds difficulty."
Hip Extension with Bands,Intermediate,Lower body exercise targeting the glutes with resistance bands.,"Strengthens the glutes, bands add resistance."
Kipping Muscle Up,Advanced,Upper body exercise combining a pull-up with a push-up motion.,"Combines pull-up and push-up, requires upper body strength."
Machine Lateral Raise,Intermediate,Shoulder exercise using a machine for lateral raises.,"Targets the shoulders, machine provides consistent resistance."
Ankle Circles,Beginner,Ankle mobility and strengthening exercise involving circular movements.,"Improves ankle strength and mobility, simple yet effective."
Reverse Plate Curls,Intermediate,Arm exercise focusing on reverse curls using a weight plate.,"Targets the arms, reverse grip focuses on biceps and forearms."
Clean Pull,Intermediate,Pull movement focusing on the clean pull technique.,"Develops explosive power, clean pull technique requires coordination."
Push Up to Side Plank,Intermediate,Core exercise combining a push-up with a side plank.,"Combines core strength with upper body stability, adds complexity."
Lying Close-Grip Bar Curl On High Pulley,Intermediate,"Bicep curl performed lying down, focusing on a high pulley attachment.","Targets the biceps, lying position focuses on muscle isolation."
Behind-the-neck pull-down,Intermediate,Lat pull-down exercise performed behind the neck.,"Targets the lats, behind-the-neck position adds difficulty."
Isometric Chest Squeezes,Beginner,Chest exercise focusing on isometric holds.,"Strengthens the chest, isometric hold increases muscle engagement."
Seated leg tuck,Intermediate,"Core exercise performed while seated, involving leg tucks.","Strengthens the core, seated position challenges stability."
Standing Biceps Stretch,Beginner,Stretching exercise targeting the biceps.,"Improves bicep flexibility, suitable for cooldowns."
Incline cable straight-bar triceps extension,Intermediate,Triceps extension performed on an incline bench with a cable.,"Targets the triceps, incline position adds intensity."
Groin and Back Stretch,Beginner,Stretch focusing on the groin and back muscles.,"Improves flexibility in the groin and back, suitable for warm-ups."
Bench skip,Intermediate,Plyometric exercise involving skipping over a bench.,"Develops leg power and coordination, requires agility."
Scissor Kick,Intermediate,Core exercise involving scissor-like leg movements.,"Strengthens the core, scissor movement challenges stability."
Smith machine pistol squat,Advanced,Single-leg squat performed using a Smith machine.,"Challenges leg strength and balance, Smith machine adds stability."
Wide-Stance Leg Press,Intermediate,Leg press performed with a wide stance.,"Targets the legs, wide stance focuses on the outer thighs."
Dumbbell Squat To A Bench,Intermediate,Squat exercise performed to a bench for depth control.,"Improves squat technique, bench guides depth."
Kettlebell Seated Press,Intermediate,Shoulder press performed while seated with kettlebells.,"Strengthens shoulders, seated position adds stability."
Floor rope climb,Advanced,Upper body exercise mimicking rope climbing on the floor.,"Mimics rope climbing, develops upper body strength."
Smith machine stiff-legged deadlift,Intermediate,"Deadlift variation focusing on the hamstrings, using a Smith machine.","Targets hamstrings, stiff-legged movement adds intensity."
Single-arm kettlebell overhead squat,Advanced,"Overhead squat performed with a kettlebell, one arm at a time.","Challenges balance and leg strength, single-arm focus adds difficulty."
Barbell Side Bend,Intermediate,Oblique exercise involving side bends with a barbell.,"Strengthens obliques, side bend movement isolates muscles."
Double Kettlebell Jerk,Advanced,Explosive kettlebell exercise combining a jerk movement.,"Develops explosive power, kettlebell adds challenge."
90-degree jump squat,Intermediate,Lower body exercise focusing on 90-degree jumps and squats.,"Improves leg power, 90-degree jump adds intensity."
Pin Presses,Advanced,Upper body exercise focusing on partial range presses.,"Targets chest and triceps, partial range focuses on strength."
Backward Drag,Intermediate,Lower body exercise involving dragging a weight backwards.,"Strengthens lower body, backward movement adds challenge."
Toe Touchers,Beginner,Core exercise focusing on touching the toes.,"Improves core strength, toe touchers target the abs."
Alternate Leg Diagonal Bound,Intermediate,Agility and leg power exercise involving diagonal jumps.,"Develops leg power and agility, diagonal bound requires coordination."
Landmine Linear Jammer,Intermediate,Upper body exercise focusing on pressing a bar in a linear motion.,"Strengthens upper body, linear pressing motion adds intensity."
Sled Push,Advanced,Full-body exercise involving pushing a weighted sled.,"Builds full-body strength, sled push challenges endurance."
Clean Shrug,Advanced,Shrug exercise focusing on the clean movement.,"Challenges the traps and upper back, clean motion adds complexity."
Backward Medicine Ball Throw,Intermediate,"Throwing exercise involving a medicine ball, targeting the back.","Develops explosive back strength, medicine ball adds resistance."
Kettlebell Arnold Press,Intermediate,"Shoulder press performed with kettlebells, inspired by Arnold Schwarzenegger.","Targets the shoulders, kettlebells challenge stability and strength."
Barbell squat with plate slide,Advanced,Squat variation including a sliding plate movement.,Combines traditional squat with additional plate slide movement.
Monster Walk,Intermediate,Lower body exercise focusing on lateral band walks.,"Targets lower body muscles, band adds resistance."
Upward Stretch,Beginner,Stretching exercise targeting the upper body.,"Improves upper body flexibility, simple yet effective."
Barbell Guillotine Bench Press,Advanced,Bench press variation with a focus on upper chest.,"Targets upper chest, guillotine style increases intensity."
Standing Toe Touches,Beginner,Flexibility exercise focusing on touching the toes while standing.,Improves hamstring flexibility and lower back mobility.
Shoulder Circles,Beginner,Shoulder mobility exercise involving circular movements.,"Enhances shoulder mobility, circular motion aids joint health."
Lying groin stretch with band,Beginner,Groin stretching exercise performed lying down with a band.,"Increases groin flexibility, band provides gentle resistance."
Standing Hamstring and Calf Stretch,Beginner,Stretch focusing on hamstrings and calves while standing.,"Combines hamstring and calf stretching, suitable for all levels."
Side-to-side push-up,Intermediate,Push-up variation involving side-to-side movement.,"Adds variation to push-ups, targets chest and triceps."
Piriformis SMR,Beginner,Self-myofascial release targeting the piriformis muscle.,"Relieves tightness in piriformis, beneficial for lower back health."
Scapular Pull-Up,Intermediate,Back exercise focusing on scapular movements during a pull-up.,"Strengthens back muscles, focuses on scapular retraction."
Cable Seated Lateral Raise,Intermediate,Shoulder exercise performed seated with a cable for lateral raises.,"Targets side deltoids, cable adds consistent resistance."
Lower Back Curl,Intermediate,Lower back exercise focusing on spinal curling.,"Strengthens lower back, focuses on spinal flexion and extension."
One-Arm Flat Bench Dumbbell Flye,Intermediate,Chest exercise involving a one-arm dumbbell fly on a flat bench.,"Isolates chest muscles, one-arm variation challenges balance."
Suspended split squat,Advanced,Leg exercise focusing on squats with a suspension trainer.,"Targets legs, suspension trainer adds instability."
Incline barbell shoulder protraction,Advanced,Incline bench press focusing on shoulder protraction.,"Focuses on shoulder stability, incline position challenges upper chest."
Behind-the-head push-press,Advanced,Shoulder press performed behind the head.,"Targets shoulders, behind-the-head position adds difficulty."
Straight Bar Bench Mid Rows,Intermediate,Row exercise focusing on the mid-back on a bench.,"Strengthens mid-back, bench provides stability."
Standing hip extension,Intermediate,Hip extension exercise performed standing.,"Targets glutes and hamstrings, standing position increases intensity."
Standing Towel Triceps Extension,Intermediate,"Triceps extension performed with a towel, focusing on resistance.","Strengthens triceps, towel resistance adds challenge."
