Name,Difficulty,Summary,Reasoning
Seated Flat Bench Leg Pull-In,Beginner,Leg pull-in exercise performed lying on a flat bench.,"Targets the lower abs, simple and effective."
Barbell shrug,Intermediate,Shoulder exercise involving shrugging with a barbell.,"Targets the traps, requires control and strength."
Standing cable rear delt row,Intermediate,Rear deltoid row performed with a cable machine.,"Targets the rear deltoids, cable adds constant tension."
Flat Bench Lying Leg Raise,Beginner,Leg raise exercise performed lying on a flat bench.,"Targets the lower abs, requires control and stability."
Hack Squat,Intermediate,Leg exercise performed on a hack squat machine.,"Targets the legs, hack squat machine offers stability."
Dumbbell skullcrusher,Intermediate,Triceps exercise involving a skullcrushing motion with dumbbells.,"Targets the triceps, requires control and form."
Man-maker,Advanced,Full-body conditioning exercise combining several movements.,"Combines multiple exercises, requires strength and endurance."
Pallof press,Intermediate,Core stabilization exercise performed with a cable machine.,"Improves core stability, requires control."
Knees tucked crunch,Intermediate,Abdominal crunch with knees tucked in.,"Targets the abs, requires control and stability."
Straight-arm dumbbell pull-over,Intermediate,Upper body exercise involving pulling a dumbbell over the chest.,"Targets the lats and chest, requires control and form."
Arms-crossed jump squat,Intermediate,Plyometric squat variation with arms crossed.,"Improves lower body power, requires coordination."
Decline Smith Press,Intermediate,Chest press performed on a decline bench with a Smith machine.,"Targets the lower chest, Smith machine adds stability."
Band Skull Crusher,Intermediate,Triceps exercise involving a skullcrushing motion with bands.,"Targets the triceps, bands provide consistent resistance."
Side Wrist Pull,Beginner,Forearm exercise focusing on the side wrist.,"Targets forearm muscles, requires control."
Isometric Wipers,Advanced,Core exercise involving isometric hold with leg movements.,"Challenges core strength, requires control and stability."
Skating,Intermediate,Cardiovascular exercise mimicking the motion of ice skating.,"Improves cardiovascular fitness, requires coordination."
Cable cross-over,Intermediate,Chest exercise involving a crossover motion with cables.,"Targets the chest muscles, requires control and stability."
Treadmill running,Beginner,Cardiovascular exercise performed on a treadmill.,"Good for cardiovascular health, suitable for all fitness levels."
One Arm Pronated Dumbbell Triceps Extension,Intermediate,"Triceps extension with one arm, using a dumbbell with a pronated grip.","Isolates the triceps, requires control and form."
Single-arm kettlebell clean and jerk,Advanced,Kettlebell exercise combining a clean and a jerk with one arm.,"Challenging, requires technique, coordination, and strength."
Side To Side Chins,Intermediate,Pull-up variation moving from side to side.,"Targets the back muscles, requires upper body strength."
Incline Dumbbell Bench With Palms Facing In,Intermediate,"Incline bench press with dumbbells, palms facing in.","Targets the chest muscles, palms-in position focuses on the upper chest."
Seated palms-down wrist curl,Beginner,Wrist curl exercise focusing on the forearm extensors.,"Targets forearm extensors, good for grip strength."
Standing leg swing,Intermediate,Leg exercise involving swinging movements.,Improves leg flexibility and mobility.
Clock push-up,Intermediate,Push-up variation involving movement around a clock.,Challenges chest and shoulder strength with dynamic movement.
Machine seated row,Intermediate,Back exercise performed using a machine for seated rows.,"Targets the back muscles, machine provides stability."
Lying Face Up Plate Neck Resistance,Intermediate,Neck resistance exercise using a plate while lying face up.,"Strengthens the neck muscles, requires control."
Weighted sissy squat,Advanced,"Quad-focused squat variation, known for its intensity.","Challenging quad exercise, requires strength and balance."
Jog In Place,Beginner,Cardio exercise mimicking the motion of jogging in place.,"Simple cardio exercise, suitable for warming up."
Dumbbell Raise,Intermediate,Shoulder exercise involving raising dumbbells.,"Targets the shoulder muscles, requires control and form."
Palms-Down Dumbbell Wrist Curl Over A Bench,Beginner,Wrist curl exercise focusing on the forearm flexors.,"Targets forearm flexors, good for grip strength."
One Arm Supinated Dumbbell Triceps Extension,Intermediate,Triceps extension with one arm using a dumbbell with a supinated grip.,"Isolates the triceps, requires control and form."
Stationary bike,Beginner,Cardiovascular exercise performed on a stationary bike.,"Low-impact cardio, suitable for all fitness levels."
Dumbbell bent-over row,Intermediate,"Rowing exercise targeting the back, performed with dumbbells.","Targets the back muscles, requires good form."
Barbell thruster,Intermediate,Full-body exercise combining a squat with an overhead press.,"Combines strength and endurance, full-body exercise."
Flutter Kicks,Intermediate,Core exercise involving flutter kick movements.,"Targets the core muscles, requires endurance."
Dumbbell sumo squat,Intermediate,Squat variation performed with a wide stance and dumbbells.,"Targets the legs, wide stance focuses on the inner thighs."
Barbell upright row,Intermediate,Shoulder and upper back exercise involving an upright row.,"Targets the shoulders and traps, requires control."
Superman,Beginner,Back and core exercise involving extending the arms and legs.,"Strengthens the back and core, requires control."
Straight-Arm Pulldown,Intermediate,Back exercise focusing on pulling down with straight arms.,"Targets the lats, requires control and form."
Barbell stiff-legged deadlift,Intermediate,"Deadlift variation focusing on the hamstrings, performed with a barbell.","Focuses on the hamstrings, requires good form."
Standing One-Arm Dumbbell Triceps Extension,Intermediate,Triceps extension performed standing with one arm and a dumbbell.,"Targets the triceps, standing position increases difficulty."
Smith machine bench press,Intermediate,Bench press exercise performed on a Smith machine.,"Provides stability, targets the chest, suitable for all levels."
Seated Side Lateral Raise,Intermediate,Shoulder exercise involving lateral raises while seated.,"Isolates the shoulder muscles, seated position increases stability."
Dumbbell Lying Rear Lateral Raise,Intermediate,Rear deltoid exercise performed lying down with dumbbells.,"Targets the rear deltoids, lying position isolates the muscle."
Dumbbell preacher curl,Intermediate,Bicep curl performed on a preacher bench with dumbbells.,"Isolates the biceps, preacher bench helps maintain form."
Front Raise And Pullover,Intermediate,Combination of a front raise and pullover with weights.,"Targets the shoulders and chest, requires coordination."
Dumbbell seated box jump,Advanced,Plyometric box jump performed while seated with dumbbells.,"Challenges lower body power and stability, advanced difficulty."
Middle Back Shrug,Intermediate,Shrug exercise targeting the middle back muscles.,"Targets the middle back, requires good form."
Incline face-down bar front raise,Intermediate,Front raise exercise for the shoulders performed incline and face-down.,"Targets the front deltoids, incline position increases difficulty."
Butt-Ups,Intermediate,Abdominal exercise focusing on lifting the hips.,"Targets the lower abs, requires control and strength."
Band Good Morning (Pull Through),Intermediate,"Lower back exercise using resistance bands, mimicking a good morning.","Targets the lower back, band adds resistance."
Bodyweight Reverse Lunge,Beginner,Reverse lunge exercise performed using bodyweight.,"Fundamental leg exercise, good for beginners."
Seated One-Arm Dumbbell Palms-Down Wrist Curl,Beginner,"Wrist curl focusing on the forearm extensors, seated with one arm.","Targets forearm extensors, good for grip strength."
Glute Kickback,Intermediate,Glute-focused exercise involving a kicking back motion.,"Targets the glutes, requires control and form."
Treadmill jogging,Beginner,Cardiovascular exercise performed by jogging on a treadmill.,"Low-impact cardio, suitable for all fitness levels."
Plate Pinch,Intermediate,Grip strength exercise involving holding and pinching weight plates.,"Improves grip strength, requires endurance."
Yates Row Reverse Grip,Intermediate,"Rowing exercise with a reverse grip, targeting the upper back.","Targets the back, reverse grip focuses on upper back."
Linear Acceleration Wall Drill,Intermediate,Speed and acceleration drill performed against a wall.,"Improves acceleration and leg power, requires strength."
Reverse-grip bench press,Intermediate,"Bench press with a reverse grip, targeting the lower chest.","Targets the lower chest, reverse grip changes emphasis."
Leverage Decline Chest Press,Intermediate,Decline chest press performed on a leverage machine.,"Targets the chest, leverage machine adds stability."
Chain Handle Extension,Intermediate,Tricep extension using chain handles for added difficulty.,"Targets the triceps, chains add variable resistance."
Bench Press with Chains,Advanced,Bench press variation using chains for resistance.,"Increases difficulty of the bench press, chains add instability."
Bench barbell roll-out,Intermediate,Core exercise combining a roll-out with a barbell on a bench.,"Challenges core strength, unique combination of movements."
Incline Push-Up Depth Jump,Intermediate,Push-up variation combining an incline push-up with a depth jump.,"Combines push-up with explosive movement, increases difficulty."
Push-Up Wide,Beginner,"Wide grip push-up, focusing on the chest and shoulders.","Targets the chest and shoulders, wide grip challenges stability."
Exercise ball weighted hyperextension,Intermediate,Back extension performed on an exercise ball with added weight.,"Strengthens the lower back, added weight increases intensity."
Barbell behind-the-back shrug,Intermediate,"Shrug exercise targeting the traps, performed with the barbell behind the back.","Targets the traps, behind-the-back position adds difficulty."
Lying Supine Dumbbell Curl,Intermediate,Bicep curl performed lying down with dumbbells.,"Isolates the biceps, lying position helps maintain form."
Internal Rotation with Band,Beginner,Shoulder rotation exercise using a resistance band.,Improves shoulder mobility and rotator cuff strength.
Machine Preacher Curls,Intermediate,Bicep curl performed on a preacher curl machine.,"Isolates the biceps, machine provides stability."
Bottoms-Up Clean From The Hang Position,Advanced,Advanced kettlebell movement from a hang position.,"Challenging, requires technique, coordination, and strength."
Single-arm kneeling lat pull-down,Intermediate,Single-arm lat pull-down performed while kneeling.,"Targets the lats, single-arm focus increases difficulty."
Floor Press,Intermediate,Upper body pressing exercise performed lying on the floor.,"Targets the chest and triceps, floor provides stability."
Chest Push (multiple response),Intermediate,Chest push exercise using multiple responses.,"Challenges the chest muscles, requires control and coordination."
Feet-elevated oblique crunch,Intermediate,Oblique crunch performed with feet elevated.,"Targets the obliques, elevated position increases difficulty."
Elevated Cable Rows,Intermediate,Rowing exercise performed with cables at an elevated position.,"Targets the back, elevated position challenges stability."
Incline Dumbbell Flyes - With A Twist,Intermediate,Incline dumbbell fly variation with a twist.,"Targets the chest, twist motion engages more muscles."
Cross Over - With Bands,Intermediate,Chest exercise using bands for crossover movement.,"Targets the chest, bands provide constant tension."
Dumbbell iron cross squat,Intermediate,Squat variation combined with a dumbbell iron cross.,Combines leg strength with shoulder stability.
Split Jerk,Advanced,Olympic weightlifting movement involving a split and a jerk.,"Requires significant technique, strength, and coordination."
Standing Low-Pulley Deltoid Raise,Intermediate,Shoulder raise performed with a low-pulley cable.,"Targets the shoulders, low-pulley adds variation."
Cobra Triceps Extension,Intermediate,Triceps extension performed in a cobra position.,"Targets the triceps, cobra position increases difficulty."
Advanced Kettlebell Windmill,Advanced,Advanced kettlebell exercise involving a windmill movement.,Challenges core strength and shoulder stability.
Rack pull,Intermediate,Upper back exercise focusing on pulling from a rack.,"Targets the upper back, rack pull isolates the movement."
Dumbbell step-up,Intermediate,Leg exercise involving stepping up onto a platform with dumbbells.,"Challenges the legs and balance, step-up movement."
Smith machine inverted row,Intermediate,Rowing exercise performed inverted on a Smith machine.,"Targets the back, inverted position adds difficulty."
Bent-arm dumbbell pull-over,Intermediate,Dumbbell exercise involving pulling over with bent arms.,"Targets the chest and lats, pull-over motion."
Reverse-grip barbell curl,Intermediate,Bicep curl with a reverse grip using a barbell.,"Targets the biceps, reverse grip changes emphasis."
Standing Cable Wood Chop,Intermediate,Core exercise involving a chopping motion with a cable.,"Challenges the core, requires rotational strength."
Band Pull Apart,Intermediate,Upper back exercise using bands for pulling apart.,Improves shoulder mobility and upper back strength.
Cable rope hammer curl,Intermediate,Bicep curl using a rope attachment on a cable machine.,"Targets the biceps, rope adds a hammer curl variation."
Standing crossed-cable rear delt fly,Intermediate,Rear delt fly performed with crossed cables while standing.,"Targets the rear deltoids, crossed cables add variation."
Kettlebell Turkish Get-Up (Lunge style),Advanced,Advanced kettlebell exercise combining a get-up with a lunge.,"Challenging full-body movement, requires balance and strength."
Reverse Machine Flyes,Intermediate,Reverse fly exercise targeting the rear deltoids on a machine.,"Isolates the rear deltoids, machine adds stability."
Single-leg kettlebell deadlift,Intermediate,Deadlift variation performed with one leg using a kettlebell.,"Challenges balance and strength, focuses on one leg."
Machine chest press,Intermediate,Chest press exercise performed on a machine.,"Targets the chest, machine provides stability and control."
Supine Chest Throw,Intermediate,Chest exercise involving throwing a medicine ball while lying down.,"Improves explosive power in the chest, requires coordination."
Push-jerk,Advanced,Olympic weightlifting movement involving a jerk from the shoulders.,"Requires technique, strength, and coordination."
One-Arm Kettlebell Row,Intermediate,Rowing exercise performed with one arm using a kettlebell.,"Targets the back muscles, single-arm focus increases difficulty."
Mixed Grip Chin,Intermediate,Chin-up variation using a mixed grip.,"Challenges grip and back strength, mixed grip varies the load."
Bradford/Rocky Presses,Intermediate,Shoulder press variation alternating between front and back.,"Targets the shoulders, alternating presses add difficulty."
Incline anti-gravity shoulder press,Intermediate,Shoulder press performed on an incline bench against gravity.,"Targets the shoulders, incline angle challenges stability."
Alien Squat,Intermediate,Leg exercise involving a squat with a unique stance.,Challenges leg strength with a unique squat form.
Barbell back squat,Intermediate,Fundamental lower body exercise involving squatting with a barbell.,Fundamental exercise for leg and core strength.
Neutral-grip pull-up,Intermediate,Pull-up variation performed with a neutral grip.,"Targets the back and biceps, neutral grip focuses on lats."
Bodyweight triceps press,Intermediate,Bodyweight exercise focusing on the triceps.,"Targets the triceps, bodyweight adds intensity."
Cable reverse crunch,Intermediate,Abdominal exercise performed with a cable for reverse crunches.,"Targets the abs, cable adds resistance."
Cable Hip Adduction,Intermediate,Hip adduction exercise performed using a cable machine.,"Targets the inner thighs, cable machine adds resistance."
Butt Kicks,Beginner,Cardiovascular exercise mimicking the motion of kicking.,"Simple cardio exercise, good for leg agility."
Machine-assisted pull-up,Beginner,Pull-up exercise assisted by a machine.,"Assists with pull-ups, suitable for beginners."
Standing Cable Chest Press,Intermediate,Chest press exercise performed standing using a cable machine.,"Targets the chest, standing position requires core stability."
Lying cable biceps curl,Intermediate,Bicep curl performed lying down using a cable.,"Targets the biceps, lying position isolates the muscle."
Seated Back Extension,Intermediate,Back extension exercise performed while seated.,"Strengthens the lower back, seated position adds stability."
Low Cable Triceps Extension,Intermediate,Triceps extension exercise using a low cable setup.,"Targets the triceps, low cable setup adds variation."
Iliotibial band SMR,Beginner,Self-myofascial release for the iliotibial band.,Improves flexibility and reduces tightness in the IT band.
Head-on-bench dumbbell rear delt raise,Intermediate,"Rear delt raise performed with dumbbells, head on a bench.","Isolates the rear deltoids, head-on-bench adds stability."
Pendlay Row,Intermediate,Rowing exercise focusing on the middle back using a barbell.,"Targets the middle back, requires good form and strength."
Dumbbell Clean,Intermediate,Full-body movement involving a clean motion with dumbbells.,Combines full-body strength and coordination with dumbbells.
Lying rear delt fly,Intermediate,Rear deltoid exercise performed lying down with dumbbells.,"Targets the rear deltoids, lying position isolates muscles."
Seated Bent-Over Two-Arm Dumbbell Triceps Extension,Intermediate,Triceps extension performed seated with two dumbbells.,"Isolates the triceps, seated position focuses on muscle contraction."
Recumbent Bike,Beginner,"Cardio workout on a recumbent bike, focusing on the quadriceps.","Low-impact cardio, focuses on leg strength, suitable for beginners."
Thigh abductor,Intermediate,Hip abductor strengthening exercise on a machine.,"Strengthens the hip abductors, machine provides stability."
Standing barbell calf raise,Intermediate,Calf raise exercise targeting the calves with a barbell.,"Targets calf muscles, standing position increases intensity."
Treadmill walking,Beginner,Low-intensity cardio workout walking on a treadmill.,"Low-intensity cardio, suitable for all fitness levels."
Romanian Deadlift,Intermediate,Deadlift exercise focusing on the hamstrings using a barbell.,"Focuses on hamstrings, requires good form and strength."
Box Jump (Multiple Response),Advanced,Jumping exercise focusing on explosive leg power.,"Develops leg power, requires coordination and strength."
Bent-knee reverse crunch,Intermediate,Reverse crunch exercise focusing on the abdominals.,"Targets the abs, reverse motion intensifies the exercise."
Cable overhead triceps extension,Intermediate,Triceps extension using a cable overhead setup.,"Targets the triceps, overhead extension increases intensity."
Smith machine bent-over row,Intermediate,Back rowing exercise using a Smith machine.,"Strengthens the back, Smith machine provides stability."
Knee Tuck Jump,Advanced,Plyometric exercise focusing on leg power with knee tucks.,"Improves leg power, requires coordination and agility."
Cable straight-bar upright row,Intermediate,Upright row exercise using a cable straight-bar.,"Strengthens shoulders and traps, upright position focuses on upper body."
Seated Good Mornings,Beginner,Lower back strengthening exercise in a seated position.,"Strengthens lower back, seated position focuses on good mornings."
Close-grip dumbbell bench press,Advanced,Close-grip dumbbell press focusing on the chest muscles.,"Targets chest, close grip focuses on triceps and inner chest."
Zercher squat,Intermediate,Leg squat exercise focusing on the quadriceps using a Zercher hold.,"Challenges quads, Zercher hold increases squat difficulty."
Full Range-Of-Motion Lat Pulldown,Beginner,Lat pulldown exercise focusing on full range of motion.,"Targets lats, full range of motion increases effectiveness."
Cable Shoulder Press,Intermediate,Shoulder press exercise using a cable setup.,"Strengthens shoulders, cable setup provides consistent tension."
Cable Russian Twists,Advanced,Core strengthening exercise with Russian twists using a cable.,"Strengthens core, Russian twists add rotational component."
EZ-bar skullcrusher-,Beginner,Triceps extension exercise using an EZ-bar.,"Targets triceps, EZ-bar provides comfortable grip."
Stiff Leg Barbell Good Morning,Intermediate,Lower back strengthening exercise focusing on good morning movements.,"Strengthens lower back, good morning movement focuses on hamstrings."
Standing Dumbbell Reverse Curl,Beginner,Reverse curl exercise focusing on the biceps using dumbbells.,"Targets biceps, reverse grip focuses on forearms."
Lying Close-Grip Barbell Triceps Press To Chin,Beginner,Triceps press exercise focusing on the triceps using an EZ-bar.,"Targets triceps, close-grip focuses on tricep isolation."
Tate Press,Intermediate,Bench press exercise performed on a Smith machine.,"Targets the triceps, emphasizes the lockout phase."
Back Flyes - With Bands,Beginner,Shoulder exercise involving lateral raises while seated.,"Targets the upper back, bands add resistance."
Ab Crunch Machine,Beginner,Rear deltoid exercise performed lying down with dumbbells.,"Isolates the abs, machine adds stability and resistance."
Alternating heel-touch,Beginner,Bicep curl performed on a preacher bench with dumbbells.,"Simple core exercise, good for targeting obliques."
Wall ball toss,Intermediate,Combination of a front raise and pullover with weights.,Improves explosive power and coordination.
Smith Machine Incline Bench Press,Intermediate,Plyometric box jump performed while seated with dumbbells.,"Targets the upper chest, Smith machine adds stability."
Machine Shoulder (Military) Press,Intermediate,Shrug exercise targeting the middle back muscles.,"Targets the shoulders, machine provides consistent resistance."
Fire Hydrant,Beginner,Front raise exercise for the shoulders performed incline and face-down.,"Targets the glutes, mimics a fire hydrant movement."
Cuban press,Intermediate,Abdominal exercise focusing on lifting the hips.,"Combines shoulder and arm movements, requires coordination."
Reverse Flyes With External Rotation,Intermediate,"Lower back exercise using resistance bands, mimicking a good morning.","Targets the rear deltoids, added rotation increases difficulty."
Hanging wind sprint,Intermediate,Reverse lunge exercise performed using bodyweight.,"Challenges core and upper body strength, mimics sprinting motion."
Windmills,Intermediate,"Wrist curl focusing on the forearm extensors, seated with one arm.","Improves core strength and flexibility, requires coordination."
Bent-arm barbell pull-over,Intermediate,Glute-focused exercise involving a kicking back motion.,"Targets the chest and lats, emphasizes the pull-over motion."
Sphinx push-up,Intermediate,Cardiovascular exercise performed by jogging on a treadmill.,"Strengthens triceps and core, Sphinx position adds difficulty."
Smith Machine Close-Grip Bench Press,Intermediate,Grip strength exercise involving holding and pinching weight plates.,"Targets the triceps and chest, close grip focuses on triceps."
Palms-out incline biceps curl,Intermediate,"Rowing exercise with a reverse grip, targeting the upper back.","Targets the biceps, incline position and palm-out grip add variation."
Alternating Cable Shoulder Press,Intermediate,Speed and acceleration drill performed against a wall.,"Targets the shoulders, alternating arms add challenge."
Rocket Jump,Intermediate,"Bench press with a reverse grip, targeting the lower chest.","Develops leg power, requires explosive strength."
Yoke Walk,Advanced,Decline chest press performed on a leverage machine.,"Tests full-body strength and endurance, requires balance."
Romanian Deadlift with Kettlebell,Intermediate,Tricep extension using chain handles for added difficulty.,"Focuses on hamstrings, kettlebell adds intensity."
Smith machine leg press,Intermediate,Bench press variation using chains for resistance.,"Targets the legs, Smith machine provides stability."
Jefferson Squats,Advanced,Core exercise combining a roll-out with a barbell on a bench.,"Challenges leg strength and flexibility, unique stance."
Single-arm low cable triceps extension,Intermediate,Push-up variation combining an incline push-up with a depth jump.,"Targets the triceps, single-arm focus increases difficulty."
Smith machine straight-legged hip raise,Intermediate,"Wide grip push-up, focusing on the chest and shoulders.","Strengthens glutes, Smith machine adds stability."
Reverse Hyperextension,Intermediate,Back extension performed on an exercise ball with added weight.,"Strengthens lower back, focuses on hyperextension."
Jerk Dip Squat,Advanced,Lower body exercise combining a squat with a jerk motion.,"Challenges coordination and lower body strength, advanced movement."
Kettlebell plyo push-up,Advanced,Push-up variation with kettlebells and added plyometric element.,"Increases upper body power, requires strength and coordination."
Weighted Sit-Ups - With Bands,Intermediate,Abdominal crunches performed with added resistance from bands.,"Targets the abs, bands add resistance, increasing difficulty."
Depth jump box jump,Advanced,Plyometric exercise involving jumps onto and off a box.,"Develops explosive leg power, advanced coordination required."
Bodyweight Walking Lunge,Intermediate,Lower body exercise involving walking lunges.,"Strengthens legs and improves endurance, suitable for all levels."
