Name,Difficulty,Summary,Reasoning
Rickshaw Carry,Intermediate,Carrying a loaded frame for distance.,"Requires moderate balance and strength, and a level of coordination."
Single-Leg Press,Beginner,Leg press exercise performed with one leg.,"Machine-based and simple movement, suitable for beginners."
Landmine twist,Intermediate,Twisting motion using a barbell fixed at one end.,Involves moderate complexity and requires good form.
Weighted pull-up,Advanced,Pull-ups performed with additional weight.,"High intensity and strength demand, suitable for advanced users."
T-Bar Row with Handle,Intermediate,Rowing movement with a barbell fixed at one end.,Requires substantial technical skill and moderate intensity.
Palms-down wrist curl over bench,Beginner,Wrist curls with palms facing down.,"Simple free weight exercise, easy to perform with low injury risk."
Atlas Stones,Advanced,Lifting heavy spherical stones.,"High intensity and strength demand, specific to advanced training."
Dumbbell front raise to lateral raise,Intermediate,Front and lateral raise combination with dumbbells.,Moderate complexity and requires good control.
Clean from Blocks,Advanced,Lifting a barbell from blocks to a front rack position.,"High complexity and skill requirement, specific to sports training."
Incline Hammer Curls,Beginner,Bicep curls performed on an incline bench.,"Simple free weight exercise, suitable for beginners."
Straight-bar wrist roll-up,Beginner,Wrist roll exercise using a barbell.,"Basic forearm exercise, low complexity and injury risk."
Barbell glute bridge,Beginner,Hip lift movement with a barbell.,"Simple to perform, moderate intensity, suitable for beginners."
Clean and press,Advanced,Lifting a barbell from the ground to overhead.,"High complexity and skill, explosive movement."
Triceps dip,Intermediate,Upper body exercise targeting the triceps.,Requires moderate strength and balance.
Dumbbell farmer's walk,Intermediate,Walking while holding heavy dumbbells.,Moderate intensity and requires balance and grip strength.
Palms-up wrist curl over bench,Beginner,Wrist curls with palms facing up.,"Basic forearm exercise, easy to learn and perform."
Barbell Full Squat,Intermediate,Full range squat with a barbell.,"Moderate to high complexity, requires good form."
Barbell deficit deadlift,Advanced,Deadlift performed on a raised platform.,"High complexity, requires significant technical skill."
Barbell Deadlift,Intermediate,Lifting a barbell off the ground to hip level.,Moderate complexity and technical skill required.
Single-arm palm-in dumbbell shoulder press,Intermediate,"Shoulder press with one arm, palm facing inwards.",Moderate technical skill and balance required.
Romanian Deadlift With Dumbbells,Intermediate,Hinge movement targeting the hamstrings and glutes.,"Moderate complexity, requires good form and control."
Tire flip,Advanced,Flipping a large tire over repeatedly.,"High intensity, requires strength and explosive power."
Clean Deadlift,Advanced,Deadlift variation with a focus on clean lifting techniques.,High technical skill and strength demand.
Elbow plank,Beginner,Static hold in a prone position on elbows.,"Basic exercise, suitable for beginners."
Bottoms Up,Beginner,Abdominal exercise performed lying on the back.,"Simple, low-intensity exercise, ideal for beginners."
Barbell back squat to box,Intermediate,Squatting to a box with a barbell.,"Moderately complex, requires good form and control."
Clean and jerk,Advanced,Olympic lifting movement combining a clean and an overhead jerk.,"High complexity, requires advanced technical skills."
Single-arm kettlebell push-press,Intermediate,"Overhead press with a kettlebell, using one arm.","Moderate complexity, requires balance and coordination."
Push-press,Intermediate,"Overhead press with a barbell, using leg drive.","Moderate to high complexity, combines strength and technique."
Suspended ab fall-out,Intermediate,Abdominal exercise using suspension straps.,Requires good core strength and stability.
Military press,Intermediate,Overhead barbell press from a standing position.,Moderate technical skill and shoulder strength required.
Power snatch-,Advanced,"Olympic lifting movement, lifting barbell from ground to overhead.","High technical skill, coordination, and explosive power required."
Sumo deadlift,Intermediate,Deadlift with a wide stance.,"Moderate complexity, requires good form and hip mobility."
Hang Clean,Advanced,"Olympic lifting movement, lifting barbell from hang to front rack.","High complexity, technical skill required."
Dumbbell V-Sit Cross Jab,Intermediate,Abdominal exercise combining V-sit and punching motion with dumbbells.,"Moderate complexity, requires core strength and coordination."
Reverse Band Box Squat,Advanced,Squatting with bands on a box.,"High complexity, requires specific equipment and technique."
Standing palms-in shoulder press,Intermediate,"Shoulder press with dumbbells, palms facing each other.","Moderate complexity, requires shoulder strength and stability."
Standing cable low-to-high twist,Intermediate,Twisting motion with a cable machine.,Requires good core strength and coordination.
Decline EZ-bar skullcrusher,Intermediate,Triceps exercise on a decline bench using an EZ-bar.,"Moderate complexity, targets triceps effectively."
Standing behind-the-back wrist curl,Beginner,Wrist curls performed with a barbell held behind the back.,"Simple movement, suitable for beginners."
Seated finger curl,Beginner,Curling the fingers while holding a barbell.,"Simple, low-risk exercise for forearm strength."
Wide-grip barbell curl,Beginner,Bicep curls with a wide grip on the barbell.,"Basic bicep exercise, easy to perform."
Dumbbell spell caster,Intermediate,Abdominal exercise simulating a spell casting motion with dumbbells.,"Moderate complexity, requires core engagement and control."
Dumbbell floor press,Beginner,Pressing dumbbells while lying on the floor.,"Simple, safe alternative to bench press."
Lying Face Down Plate Neck Resistance,Intermediate,"Neck strengthening exercise, lying face down with a plate.","Uncommon exercise, requires careful execution."
Pullups,Intermediate,Upper body exercise pulling oneself up on a bar.,"Requires good upper body strength, more challenging than beginner exercises."
Decline reverse crunch,Intermediate,Abdominal exercise on a decline bench.,"Requires core strength, more challenging due to decline angle."
Dumbbell Bench Press,Beginner,Pressing dumbbells on a flat bench.,"Basic chest exercise, suitable for all levels."
Jumping rope,Beginner,Cardiovascular exercise using a jump rope.,"Simple, effective for endurance, suitable for all levels."
Seated barbell shoulder press,Intermediate,Overhead press with a barbell while seated.,"Moderate complexity, requires shoulder strength and stability."
EZ-bar spider curl,Intermediate,Bicep curl variation using an EZ-bar.,"Moderate complexity, isolates biceps effectively."
Smith machine shrug,Beginner,Shoulder shrug exercise using the Smith machine.,"Simple movement, Smith machine provides stability."
Smith Machine Calf Raise,Beginner,Calf raise exercise using the Smith machine.,"Simple and safe for beginners, machine assists in balance."
Romanian Deadlift from Deficit,Advanced,Deadlift variation performed from an elevated position.,"High complexity, requires good balance and flexibility."
Power Snatch,Advanced,"Olympic lifting movement, lifting barbell from ground to overhead.","High technical skill, coordination, and explosive power required."
Pushups,Beginner,Basic bodyweight exercise targeting the chest and triceps.,"Fundamental exercise, suitable for all fitness levels."
Barbell walking lunge,Intermediate,Lunge walk with a barbell.,"Moderate complexity, requires balance and coordination."
Front Squats With Two Kettlebells,Intermediate,Squatting with two kettlebells held in front.,"Moderate complexity, requires balance and core strength."
Spider crawl,Intermediate,Bodyweight exercise involving crawling motion.,"Requires coordination, core strength, and flexibility."
Power Clean from Blocks,Advanced,"Olympic lifting movement, lifting barbell from blocks to shoulder level.","High complexity, requires explosive power and technique."
Single Leg Push-off,Intermediate,Lower body exercise focusing on single leg strength.,Requires balance and unilateral leg strength.
Hip Circles (Prone),Beginner,Hip mobility exercise performed in a prone position.,"Basic exercise, good for flexibility and beginners."
Reverse-grip bent-over row,Intermediate,Rowing exercise with a reverse grip.,"Moderate complexity, requires good form and upper back strength."
Seated Two-Arm Palms-Up Low-Pulley Wrist Curl,Beginner,Wrist curl exercise using a low-pulley machine.,"Simple, targeted exercise for forearm strength."
Back extension,Beginner,Lower back exercise often performed on a hyperextension bench.,"Basic exercise, good for developing lower back strength."
Close-grip bench press,Intermediate,Bench press variation with a close grip.,"Moderate complexity, targets triceps more than standard bench press."
Cocoons,Beginner,Abdominal exercise involving a full-body crunch motion.,"Simple and effective core exercise, suitable for beginners."
Cross-Body Crunch,Beginner,Abdominal exercise targeting the obliques.,"Basic core exercise, easy to perform."
Dumbbell Flyes,Intermediate,Chest exercise performed with dumbbells on a bench.,"Moderate complexity, requires chest strength and control."
Hammer Curls,Beginner,Bicep curl variation with a neutral grip.,"Basic exercise, suitable for arm development."
Incline dumbbell bench press,Intermediate,Bench press performed on an incline bench with dumbbells.,"Moderate complexity, targets the upper chest."
Low-cable cross-over,Intermediate,Chest exercise using cables from a low position.,"Requires chest strength and control, moderate complexity."
Single-arm high-cable side bend,Intermediate,Oblique exercise using a high cable.,"Requires core strength and stability, moderate complexity."
Seated Dumbbell Press,Intermediate,Shoulder press with dumbbells while seated.,"Moderate complexity, requires good shoulder strength."
Standing dumbbell shoulder press,Intermediate,"Shoulder press with dumbbells, performed standing.","Requires balance and shoulder strength, moderate complexity."
EZ-Bar Curl,Beginner,Bicep curl using an EZ-bar.,"Basic bicep exercise, suitable for beginners."
Olympic Squat,Advanced,Squat variation typically used by Olympic weightlifters.,"High complexity, requires excellent form and flexibility."
Natural Glute Ham Raise,Intermediate,Bodyweight exercise targeting the hamstrings and glutes.,Requires good hamstring strength and body control.
Axle Deadlift,Advanced,Deadlift performed with a thick barbell (axle).,"Higher difficulty due to the thick bar, requires strong grip and form."
Zottman Curl,Intermediate,Bicep curl variation involving rotation of the dumbbell.,"Moderate complexity, involves forearm and bicep strength."
Glute ham raise-,Intermediate,Exercise targeting the glutes and hamstrings.,Requires strength and control in the posterior chain.
Single-arm lateral raise,Beginner,Shoulder exercise performed with one arm at a time.,"Basic shoulder exercise, suitable for beginners."
Power Partials,Advanced,Strength exercise involving partial range of motion.,"Advanced technique, typically used to increase strength at specific angles."
Leverage Shrug,Intermediate,Shrug exercise using a leverage machine.,"Moderate complexity, targets the traps effectively."
Cable V-bar push-down,Beginner,Triceps exercise using a V-bar on a cable machine.,"Basic triceps exercise, suitable for beginners."
Wrist Roller,Intermediate,Forearm exercise involving rolling a weight up and down.,Requires forearm strength and endurance.
Incline dumbbell reverse fly,Intermediate,Reverse fly movement on an incline bench.,"Targets the rear delts, requires control and shoulder stability."
Stair climber,Beginner,Cardiovascular exercise mimicking stair climbing.,Simple and effective for cardiovascular fitness.
Elbow-to-knee crunch,Beginner,Abdominal exercise targeting the obliques.,"Basic core exercise, easy to perform."
Kettlebell Pistol Squat,Advanced,Single-leg squat holding a kettlebell.,"Requires high balance, strength, and coordination."
Overhead dumbbell front raise,Intermediate,"Front raise with dumbbells, lifting above the head.",Requires shoulder strength and stability.
Biceps curl to shoulder press,Intermediate,Combination exercise involving a bicep curl and shoulder press.,"Moderate complexity, requires coordination between two movements."
Weighted bench dip,Intermediate,Triceps dip on a bench with added weight.,Requires good triceps strength and balance.
Barbell Hip Thrust,Intermediate,Glute-focused exercise performed with a barbell.,Requires hip strength and control.
Forward lunge,Beginner,Basic lower body exercise involving a stepping motion.,"Fundamental leg exercise, suitable for all levels."
Barbell Bench Press - Medium Grip,Intermediate,Classic chest exercise with a barbell and a medium grip.,"Requires chest strength and control, a staple exercise."
Chest dip,Intermediate,Bodyweight exercise targeting the chest and triceps.,"Requires upper body strength, more challenging than beginner exercises."
Seated dumbbell shoulder press,Intermediate,"Shoulder press with dumbbells, performed seated.",Requires good shoulder strength and stability.
Barbell Curl,Beginner,Basic bicep exercise using a barbell.,Fundamental exercise for bicep development.
EZ-Bar Skullcrusher,Intermediate,Triceps exercise performed with an EZ-bar.,Requires triceps strength and control.
One-Arm Dumbbell Row,Intermediate,"Rowing exercise targeting the back, performed with one arm.",Requires good form and unilateral strength.
Alternating standing shoulder press,Intermediate,Overhead press performed alternating arms while standing.,"Moderate complexity, requires balance and shoulder strength."
Concentration curl,Beginner,Bicep curl performed in a seated position focusing on one arm.,"Isolates the bicep, suitable for beginners."
Decline Crunch,Intermediate,Abdominal crunches performed on a decline bench.,"More challenging than a regular crunch, targets the abs effectively."
Decline Dumbbell Flyes,Intermediate,Chest fly movement performed on a decline bench.,"Requires chest strength and control, more challenging due to decline angle."
Single-arm incline rear delt raise,Intermediate,"Shoulder exercise targeting the rear deltoids, performed one arm at a time.",Requires shoulder stability and isolation of the rear deltoids.
Alternating dumbbell front raise,Intermediate,Front raise performed alternately with each arm.,"Targets the front deltoids, requires control and balance."
Hanging toes-to-bar,Advanced,Hanging from a bar and raising toes to touch the bar.,"High complexity, requires strong core and grip strength."
Narrow-stance squat,Intermediate,Squat variation with a closer foot stance.,"Requires balance and control, targets the quads differently."
Kneeling cable oblique crunch,Intermediate,"Oblique crunches performed while kneeling, using a cable machine.","Targets the obliques, requires core strength and stability."
Reverse Grip Triceps Pushdown,Intermediate,Triceps exercise with a reverse grip on a pushdown machine.,"Focuses on the triceps with a reverse grip, moderate difficulty."
Bear crawl sled drag,Advanced,Full-body exercise involving bear crawl and sled drag.,"Combines endurance and strength, challenging full-body movement."
Rocky Pull-Ups/Pulldowns,Advanced,Pull-up variation requiring strength and coordination.,"Advanced pull-up variation, requires upper body strength."
Snatch-Grip Behind-The-Neck Overhead Press,Advanced,"Overhead press with a snatch grip, performed behind the neck.","Advanced overhead press, requires shoulder mobility and strength."
Box Squat with Bands,Advanced,"Squat with resistance bands, challenging and technical.","Technical squat variation, requires knowledge of band setup."
Flexor Incline Dumbbell Curls,Intermediate,Bicep curl on an incline bench focusing on wrist flexion.,"Focuses on bicep peak and wrist strength, moderate difficulty."
Seated One-Arm Dumbbell Palms-Up Wrist Curl,Beginner,"Wrist curl focusing on the forearm flexors, performed seated.","Simple forearm exercise, good for beginners."
Thigh adductor,Beginner,"Machine-based inner thigh exercise, easy to perform.","Easy to perform, targets the inner thighs."
Machine Bicep Curl,Beginner,"Bicep curl using a machine, straightforward and controlled.","Controlled bicep curl, good for isolating muscle."
Seated Palms-Down Barbell Wrist Curl,Beginner,"Wrist curl focusing on forearm extensors, performed seated.","Targets forearm extensors, suitable for beginners."
Car driver,Beginner,Shoulder exercise mimicking a steering wheel motion.,"Unique shoulder exercise, good for coordination."
Alternating Deltoid Raise,Intermediate,Shoulder exercise alternating between front and lateral raises.,"Moderate difficulty, good for overall shoulder development."
Hanging Oblique Knee Raise,Intermediate,Oblique exercise performed hanging from a bar.,"Challenging core exercise, targets obliques."
Bodyweight Flyes,Intermediate,"Bodyweight chest fly, requires balance and chest strength.","Challenging variation of chest fly, requires control."
Standing Calf Raises,Beginner,Calf raise performed in a standing position.,"Basic exercise, good for calf development."
Push-Ups - Close Triceps Position,Intermediate,"Push-up variation with hands close together, targeting triceps.","More challenging than regular push-ups, focuses on triceps strength."
One-Arm Long Bar Row,Intermediate,Rowing exercise using one arm with a long bar.,Requires unilateral back strength and good form.
Overhead cable curl,Intermediate,Bicep curl performed with cables from an overhead position.,"Moderate complexity, unique angle targets biceps differently."
Single-dumbbell front raise,Beginner,Front raise performed with a single dumbbell.,Simple and effective shoulder exercise.
Incline cable chest fly,Intermediate,Chest fly performed on an incline bench using cables.,"Targets chest muscles at a different angle, requires control."
Single-leg depth squat,Advanced,"Squat performed on one leg, typically down to a box or bench.","Requires significant balance, strength, and coordination."
Dumbbell suitcase crunch,Intermediate,Crunch variation performed holding a dumbbell like a suitcase.,"Adds weight to a regular crunch, increases intensity."
Plate Twist,Beginner,Twisting motion performed holding a weight plate.,"Simple core exercise, suitable for beginners."
Single-leg cable hip extension,Intermediate,Hip extension exercise performed on one leg using a cable.,"Targets glutes and hamstrings, requires balance and control."
Weighted Jump Squat,Advanced,"Squat variation with a jump, performed with added weight.",High-intensity exercise requiring power and strength.
Squat with Chains,Advanced,Squat variation performed with chains for variable resistance.,"Requires knowledge of chain setup, increases in difficulty."
Gorilla Chin/Crunch,Advanced,Combination of a chin-up and a crunch.,"Requires upper body and core strength, advanced coordination."
Kneeling cable triceps extension,Intermediate,"Triceps extension performed while kneeling, using a cable.","Targets the triceps effectively, moderate complexity."
Kneeling Cable Crunch With Alternating Oblique Twists,Intermediate,"Cable crunch with added oblique twist, performed kneeling.","Targets the abs and obliques, requires core strength."
Bicycling,Beginner,Cardiovascular exercise performed on a bicycle.,"Great for cardiovascular health, suitable for all levels."
Arnold press,Intermediate,"Shoulder press variation with rotation, popularized by Arnold Schwarzenegger.","Requires shoulder mobility and strength, more complex than standard press."
Weighted Crunches,Intermediate,Abdominal crunches performed with added weight.,"Increases the intensity of regular crunches, targets the abs."
Single-arm cable triceps extension,Intermediate,"Triceps extension using a cable machine, one arm at a time.","Isolates the triceps, requires unilateral strength."
Barbell roll-out,Advanced,Core exercise involving rolling out with a barbell.,"Requires strong core muscles and stability, advanced level."
Kneeling cable crunch,Intermediate,"Abdominal exercise performed kneeling, using a cable machine.","Targets the abs effectively, requires core strength."
Exercise Ball Pull-In,Intermediate,Core exercise involving pulling knees into the chest on a ball.,Requires core stability and balance.
Hanging leg raise,Advanced,"Core exercise performed hanging from a bar, raising legs.",Requires strong core muscles and grip strength.
Barbell Ab Rollout - On Knees,Intermediate,"Core exercise involving rolling out with a barbell, performed on knees.","Targets the abs, requires core strength and control."
Barbell Squat,Intermediate,Fundamental lower body exercise involving squatting with a barbell.,"Requires good form, strength, and mobility."
Decline barbell bench press,Intermediate,Bench press performed on a decline bench with a barbell.,"Targets the lower chest, requires chest strength and control."
Dumbbell Bicep Curl,Beginner,Basic bicep exercise performed with dumbbells.,"Fundamental exercise for bicep development, suitable for all levels."
Dumbbell Goblet Squat,Beginner,Squat variation holding a dumbbell like a goblet.,"Good for beginners, focuses on form and is less strenuous on the back."
Dumbbell squat,Beginner,Squat performed holding dumbbells at the sides.,"Basic lower body exercise, suitable for beginners."
Barbell front squat,Advanced,Squat variation with the barbell held in front of the body.,"Requires good form, balance, and upper body strength."
Close-grip pull-down,Intermediate,Lat pull-down variation with a close grip.,"Targets the lats, requires upper body strength and control."
Triceps Pushdown - Rope Attachment,Beginner,Triceps exercise using a rope attachment on a cable machine.,"Targets the triceps, suitable for beginners."
Side-to-side box skip,Intermediate,Cardiovascular exercise involving lateral movement over a box.,"Requires agility and coordination, good for cardiovascular fitness."
Smith machine shoulder press,Intermediate,Shoulder press performed on a Smith machine.,"Offers stability, good for intermediate training."
Seated triceps press,Intermediate,"Triceps exercise performed seated, typically with a dumbbell.","Isolates the triceps, requires control and upper body strength."
Dumbbell Lying Supination,Intermediate,"Bicep exercise performed lying down, involving rotation of the wrist.","Targets biceps and forearms, requires control and technique."
Pull-up,Advanced,Upper body exercise involving pulling oneself up on a bar.,"Requires upper body strength, more challenging than beginner exercises."
Wide-grip bench press,Beginner,Bench press variation with a wider grip.,"Targets the chest muscles differently, requires good form."
Close-grip EZ-bar curl,Intermediate,Bicep curl with a close grip on an EZ-bar.,"Targets the biceps, moderate complexity."
T-Bar Row,Intermediate,Rowing exercise using a T-bar machine.,"Requires back strength and good form, targets the mid-back."
Bent Over Two-Arm Long Bar Row,Intermediate,Rowing exercise performed bent over with a long bar.,"Requires good form and back strength, targets multiple back muscles."
Muscle Up,Advanced,"Combination of a pull-up and a dip, performed on a bar.","Combines strength, technique, and coordination, highly challenging."
Machine shoulder press,Beginner,Shoulder press performed using a machine.,"Good for beginners, offers stability and controlled movement."
Incline EZ-bar skullcrusher,Intermediate,Triceps exercise performed with an EZ-bar on an incline bench.,"Targets the triceps, incline position increases difficulty."
Alternating sit-through with crunch,Intermediate,Core exercise combining sit-throughs and crunches.,"Requires core strength, agility, and coordination."
Wide-Grip Decline Barbell Bench Press,Intermediate,Wide-grip variation of the bench press.,"Targets the chest with a wider grip, increases range of motion."
Rower,Beginner,Cardiovascular workout on a rowing machine.,"Great for overall fitness, strengthens multiple muscle groups."
Snatch Deadlift,Intermediate,Deadlift variation focusing on the snatch lift.,"Focuses on the snatch movement, requires technique and strength."
Front Plate Raise,Intermediate,Front raise exercise with a weight plate.,"Targets the shoulders, good for developing front deltoids."
Decline Close-Grip Bench To Skull Crusher,Advanced,Triceps exercise combining a close-grip bench press with a skull crusher.,"Combines a bench press and skull crusher, targets triceps intensely."
Lying Leg Curls,Intermediate,"Leg curl exercise performed lying down, typically on a machine.","Targets the hamstrings, good for leg development."
Cross-body hammer curl,Intermediate,Bicep curl variation with a cross-body motion.,"Isolates the biceps, requires good form."
Shotgun row,Intermediate,Rowing exercise performed with a focus on one side.,"Targets the back muscles, requires unilateral strength."
Ab Roller,Beginner,Core exercise using an ab roller for rolling movements.,Requires core stability and strength.
Reverse-grip incline dumbbell bench press,Intermediate,Reverse-grip bench press performed on an incline.,Targets the chest muscles from a different angle.
Leg Press,Beginner,Leg press exercise performed on a machine.,"Targets the legs, suitable for all fitness levels."
Stiff-Legged Dumbbell Deadlift,Intermediate,"Deadlift variation focusing on the hamstrings, using dumbbells.","Focuses on the hamstrings, requires good form."
Cable Crossover,Intermediate,"Chest exercise using cables, crossing hands at the peak.",Targets the chest muscles from multiple angles.
