Name,Difficulty,Summary,Reasoning
Weighted Ball Side Bend,Intermediate,Oblique exercise involving a side bend with a weighted ball.,"Targets obliques, weighted ball increases intensity."
Isometric Neck Exercise - Front And Back,Intermediate,Neck strengthening exercise focusing on isometric holds.,"Strengthens neck muscles, isometric holds improve stability."
Atlas Stone Trainer,Advanced,Strength exercise using an atlas stone trainer.,"Develops overall strength, atlas stone trainer adds challenge."
Peroneals-SMR,Beginner,Self-myofascial release for the peroneal muscles.,"Relieves tension in peroneals, improves ankle mobility."
Inverted Row with Straps,Intermediate,Back exercise involving inverted rows with straps.,"Strengthens the back, inverted position adds difficulty."
Extended Range One-Arm Kettlebell Floor Press,Intermediate,One-arm chest press with extended range using a kettlebell.,"Targets the chest, extended range increases challenge."
Bent Press,Advanced,Compound lift focusing on bending to one side with weight.,"Develops core and shoulder strength, bent press requires technique."
Lying Hamstring,Beginner,Stretching exercise targeting the hamstring muscles.,"Improves hamstring flexibility, lying position aids stretch."
Knee Circles,Beginner,Mobility exercise focusing on knee circles.,"Enhances knee mobility and flexibility, gentle movement."
Dumbbell Tricep Extension -Pronated Grip,Intermediate,Triceps extension with a pronated grip using dumbbells.,"Targets triceps, pronated grip changes muscle engagement."
One Arm Chin-Up,Advanced,Upper body exercise involving a one-arm chin-up.,"Challenges upper body strength, one-arm movement adds difficulty."
Intermediate Hip Flexor and Quad Stretch,Intermediate,Stretching exercise for hip flexors and quadriceps.,"Improves flexibility in hips and quads, intermediate stretch."
Snatch Shrug,Advanced,Shoulder and trap exercise involving snatch-like shrugs.,"Develops explosive power in shoulders and traps, snatch shrug technique."
Seated Dumbbell Palms-Up Wrist Curl,Beginner,Wrist curl exercise focusing on the forearms.,"Strengthens the forearms, wrist curl focuses on grip."
Barbell seal row,Intermediate,Back exercise involving rows with a barbell on a bench.,"Targets the back, seal row on bench isolates muscles."
Sit Squats,Beginner,Squat exercise focusing on sitting down and standing.,"Improves squat form, sit squat aids in depth control."
Crucifix,Advanced,Shoulder stability exercise involving a crucifix position.,"Challenges shoulder stability, crucifix position is advanced."
Calf SMR,Beginner,Self-myofascial release focusing on the calf muscles.,"Relieves tightness in calves, aids in muscle recovery."
Kettlebell alternating floor press,Intermediate,Chest press alternating arms with a kettlebell on the floor.,"Strengthens the chest, alternating motion challenges stability."
Hip Lift with Band,Intermediate,Glute exercise involving hip lifts with a resistance band.,"Targets glutes, resistance band adds intensity to hip lift."
Forward Drag with Press,Intermediate,Full-body exercise involving dragging a weight and pressing.,"Combines strength and conditioning, forward drag and press adds challenge."
Medicine Ball Chest Pass,Intermediate,Chest exercise involving passing a medicine ball.,"Develops chest power, medicine ball pass requires coordination."
Lying hamstring stretch with band,Beginner,Hamstring stretching with a band while lying down.,"Improves hamstring flexibility, band aids in stretch intensity."
Cross-body shoulder stretch,Beginner,Stretching exercise for the shoulders.,"Enhances shoulder flexibility, cross-body stretch aids mobility."
One Arm Against Wall,Intermediate,Shoulder and tricep stretch against a wall.,"Stretches shoulders and triceps, wall support adds stability."
Catch and Overhead Throw,Intermediate,Full-body exercise involving catching and throwing overhead.,"Develops full-body power, catch and throw requires coordination."
Smith Machine Hang Power Clean,Advanced,Power clean exercise on a Smith machine focusing on hang position.,"Strengthens overall power, hang clean on Smith machine is advanced."
Lying High Bench Barbell Curl,Intermediate,Bicep curl performed lying down on a high bench.,"Targets biceps, lying position increases focus on muscle isolation."
Squats - With Bands,Intermediate,Leg squat exercise performed with added resistance from bands.,"Strengthens legs, bands add variable resistance."
Dynamic chest stretch,Beginner,Chest stretching exercise focusing on dynamic movements.,"Improves chest flexibility, dynamic stretch aids mobility."
Rhomboids SMR,Beginner,Self-myofascial release targeting the rhomboids.,"Relieves tension in rhomboids, aids in upper back health."
Neck Bridge Prone,Advanced,Advanced neck exercise focusing on bridge position.,"Strengthens neck, bridge position is advanced and challenging."
Chain Press,Intermediate,Chest press exercise performed with added resistance from chains.,"Increases chest strength, chains add progressive resistance."
Standing Gastrocnemius Calf Stretch,Beginner,Calf stretching exercise focusing on the gastrocnemius.,"Improves calf flexibility, standing stretch targets gastrocnemius."
Skip,Intermediate,Cardiovascular exercise involving skipping motions.,"Increases cardiovascular fitness, skipping enhances coordination."
Hamstring-SMR,Beginner,Self-myofascial release focusing on the hamstrings.,"Relieves hamstring tightness, aids in leg recovery."
Bench Press - With Bands,Intermediate,Chest press exercise performed with added resistance from bands.,"Strengthens chest, bands provide consistent resistance."
Tricep Side Stretch,Beginner,Tricep stretching exercise focusing on the side of the body.,"Improves tricep flexibility, side stretch aids mobility."
Kneeling hip flexor stretch,Beginner,Hip flexor stretch performed in a kneeling position.,"Enhances hip flexor flexibility, kneeling position deepens stretch."
Hug A Ball,Beginner,Core stability exercise involving a stability ball.,"Stabilizes core, ball adds instability and challenge."
Quadriceps SMR,Beginner,Self-myofascial release focusing on the quadriceps.,"Relieves quadriceps tightness, aids in leg muscle recovery."
Upper Back-Leg Grab,Beginner,Upper back stretching exercise involving leg grab.,"Improves upper back flexibility, leg grab aids stretch."
Dancer's Stretch,Beginner,Stretching exercise targeting the lower body.,"Enhances lower body flexibility, dancer's stretch targets legs."
Elbow Circles,Beginner,Elbow circling exercise focusing on joint mobility.,"Increases elbow joint mobility, circling motion aids flexibility."
Wall calf stretch,Beginner,Calf stretching exercise performed against a wall.,"Improves calf flexibility, wall stretch focuses on lower leg."
Spinal Stretch,Beginner,Back stretching exercise focusing on spinal extension.,"Enhances spinal flexibility, stretch promotes back health."
Front Barbell Squat To A Bench,Intermediate,"Squat exercise performed to a bench, focusing on form.","Improves squat form, bench guides squat depth."
Anterior Tibialis-SMR,Beginner,Self-myofascial release targeting the anterior tibialis.,"Relieves tension in anterior tibialis, aids in shin muscle recovery."
Child's pose,Beginner,Stretching exercise focusing on child's pose.,"Increases full-body relaxation, child's pose aids in recovery."
Kettlebell Dead Clean,Intermediate,Kettlebell exercise involving a dead clean movement.,"Strengthens full body, dead clean targets power and coordination."
Partner farmer's walk,Advanced,Full-body exercise involving a farmer's walk with a partner.,"Builds full-body strength, farmer's walk is challenging and dynamic."
Seated Hamstring,Intermediate,Hamstring stretching exercise performed in a seated position.,"Improves hamstring flexibility, seated position focuses on stretch."
Bar shoulder extension stretch,Intermediate,Stretching exercise focusing on shoulder extension.,"Improves shoulder flexibility, intermediate stretch."
Kneeling Forearm Stretch,Beginner,Forearm stretch performed in a kneeling position.,"Enhances forearm flexibility, suitable for all levels."
Iron Crosses (stretch),Intermediate,Full body stretch involving a cross-body arm movement.,"Increases body flexibility, cross-body stretch adds complexity."
Seated Floor Hamstring Stretch,Beginner,Hamstring stretching exercise performed seated on the floor.,"Improves hamstring flexibility, seated position aids stretch."
Arm circle,Beginner,Shoulder mobility exercise involving circular arm movements.,"Enhances shoulder mobility, arm circles aid joint health."
Pelvic Tilt Into Bridge,Beginner,Core and lower back exercise combining a pelvic tilt and bridge.,"Strengthens core and lower back, combines two movements."
Seated Biceps,Beginner,Bicep curl performed while seated.,"Targets biceps, seated position focuses on muscle isolation."
90/90 Hamstring,Intermediate,Hamstring stretch involving a 90/90 leg position.,"Improves hamstring flexibility, 90/90 position challenges muscles."
All Fours Quad Stretch,Beginner,Quadriceps stretching exercise performed on all fours.,"Enhances quadriceps flexibility, all fours position aids stretch."
Cable Judo Flip,Intermediate,Full body exercise involving a cable flip motion.,"Develops full body coordination, cable adds dynamic challenge."
Exercise ball torso rotation,Intermediate,Torso rotation exercise performed on an exercise ball.,"Strengthens core, exercise ball adds instability."
Lying quad stretch with band,Beginner,Quadriceps stretch performed lying down with a band.,"Improves quadriceps flexibility, band aids in stretching."
Cat Stretch,Beginner,Back stretching exercise mimicking a cat's movement.,"Relaxes back muscles, mimics cat stretching movements."
Calf Stretch Elbows Against Wall,Beginner,Calf stretching exercise with elbows against a wall.,"Enhances calf flexibility, wall-supported stretch."
Behind Head Chest Stretch,Intermediate,Chest stretching exercise performed behind the head.,"Improves chest flexibility, behind-the-head stretch adds intensity."
Alternating Hang Clean,Advanced,Full body exercise involving alternating hang cleans.,"Develops power and coordination, alternating hang clean is challenging."
Calf Raises - With Bands,Beginner,Calf exercise performed with resistance bands.,"Strengthens calves, bands add resistance."
Calf Raise On A Dumbbell,Beginner,Calf raise exercise using a dumbbell for added resistance.,"Enhances calf strength, dumbbell adds weight."
Lying glute stretch,Beginner,Glute stretching exercise performed lying down.,"Relaxes glutes, lying position aids in stretching."
Triceps Stretch,Beginner,Triceps stretching exercise.,Improves triceps flexibility.
Side Neck Stretch,Beginner,Neck stretch focusing on the side muscles.,"Relieves neck tension, side stretch targets neck muscles."
Elbows Back,Beginner,Upper back and shoulder stretch involving elbow movements.,Enhances upper back and shoulder flexibility.
Dynamic Back Stretch,Beginner,Back stretching exercise involving dynamic movements.,"Relaxes back muscles, dynamic movement aids flexibility."
Seated bar twist,Intermediate,Core exercise focusing on twisting movements while seated.,"Strengthens core, seated twist challenges muscles."
One Half Locust,Intermediate,Lower back and hamstring exercise resembling a locust pose.,"Improves lower back flexibility, half locust pose strengthens back."
Latissimus dorsi SMR,Beginner,Self-myofascial release for the latissimus dorsi muscle.,"Relieves tension in the lats, suitable for all levels."
Seated Overhead Stretch,Beginner,Seated stretch targeting the shoulders and upper back.,Improves shoulder and upper back flexibility.
Seated Front Deltoid,Beginner,Seated stretch focusing on the front deltoid muscles.,"Targets front deltoid muscles, simple seated stretch."
Lower back SMR,Beginner,Self-myofascial release targeting the lower back.,"Eases lower back tightness, beneficial for spinal health."
Hug Knees To Chest,Beginner,Stretching exercise hugging knees to the chest.,"Relaxes lower back and hips, simple and effective."
World's greatest stretch,Intermediate,Dynamic full-body stretch combining multiple movements.,"Increases overall flexibility and mobility, dynamic movement."
Standing Hip Flexors,Beginner,Standing stretch targeting the hip flexors.,"Enhances hip flexor flexibility, standing stretch."
The Straddle,Intermediate,Stretching exercise focusing on the inner thighs and hamstrings.,"Improves inner thigh and hamstring flexibility, wide stance."
Looking At Ceiling,Beginner,Neck stretch looking towards the ceiling.,"Relaxes neck muscles, simple upward gaze."
Standing Soleus And Achilles Stretch,Beginner,Standing stretch targeting the soleus and Achilles tendon.,"Targets the lower leg muscles, standing stretch."
Upper Back Stretch,Beginner,Upper back stretching exercise.,"Relieves upper back tension, simple stretching exercise."
Alternating lunge jump,Intermediate,Plyometric exercise with alternating lunge jumps.,"Increases leg power and agility, alternating lunge adds complexity."
Chair Upper Body Stretch,Beginner,Upper body stretch performed while seated on a chair.,"Stretches upper body, suitable for seated positions."
Seated Calf Stretch,Beginner,Seated stretch focusing on the calf muscles.,"Targets calf muscles, seated stretch for ease."
Shoulder Raise,Beginner,Shoulder raise exercise focusing on deltoid muscles.,"Strengthens shoulder muscles, simple lifting movement."
Downward Facing Balance,Intermediate,Balance exercise in a downward-facing position.,"Improves balance, downward position challenges stability."
Kneeling Arm Drill,Beginner,Arm circling exercise performed while kneeling.,"Enhances arm mobility, kneeling position aids in circling."
Adductor SMR,Beginner,Self-myofascial release for the adductor muscles.,"Relieves adductor tightness, aids in leg muscle recovery."
Crossover Reverse Lunge,Intermediate,Lower body exercise with a crossover reverse lunge.,"Challenges leg muscles, crossover adds coordination."
Overhead Stretch,Beginner,Overhead stretching exercise.,"Increases overall body flexibility, upward stretch."
Frog Hops,Intermediate,Lower body plyometric exercise with frog hops.,"Develops lower body power, frog hop is dynamic."
Side Lying Groin Stretch,Beginner,"Stretch focusing on the groin area, performed side-lying.","Focuses on groin area, side-lying position adds comfort."
Chin To Chest Stretch,Beginner,Neck stretching exercise bringing the chin to the chest.,"Eases neck tension, downward motion relaxes muscles."
Middle Back Stretch,Beginner,Middle back stretching exercise.,"Relaxes middle back, simple stretching movement."
Runner's Stretch,Intermediate,Stretch focusing on the muscles used in running.,"Aids runner's muscle recovery, stretch targets relevant muscles."
One Handed Hang,Advanced,Upper body exercise focusing on grip strength in a hanging position.,"Develops grip strength, hanging position is challenging."
Exercise ball chest stretch,Beginner,Chest stretching exercise using an exercise ball.,"Improves chest flexibility, exercise ball aids in stretch."
Adductor/Groin,Beginner,Groin stretching exercise focusing on the adductor muscles.,"Enhances groin flexibility, suitable for all levels."
Knee Across The Body,Beginner,Spinal twist stretch involving crossing the knee over the body.,"Relieves spinal tension, twisting stretch aids in mobility."
Rear Leg Raises,Intermediate,Lower back and glute strengthening exercise with leg raises.,"Strengthens lower back and glutes, leg raise adds intensity."
Medicine ball scoop throw,Intermediate,Explosive upper body exercise involving a medicine ball throw.,"Develops upper body power, medicine ball throw is dynamic."
Overhead Triceps,Intermediate,Triceps stretching exercise performed overhead.,"Improves triceps flexibility, overhead position deepens stretch."
Peroneals Stretch,Beginner,Stretch focusing on the peroneal muscles of the lower leg.,"Targets peroneals, stretch aids in lower leg health."
On Your Side Quad Stretch,Beginner,Quad stretching exercise performed lying on one side.,"Increases quad flexibility, side-lying position aids stretch."
On-Your-Back Quad Stretch,Beginner,Quad stretching exercise performed lying on the back.,"Enhances quad flexibility, lying position focuses on stretch."
Chair Lower Back Stretch,Beginner,Lower back stretching exercise using a chair for support.,"Relieves lower back tension, chair aids in stretch."
Standing side bend stretch,Beginner,Upper body stretch focusing on the obliques and lat muscles.,"Improves side bend flexibility, standing position challenges muscles."
Brachialis SMR,Intermediate,Self-myofascial release for the brachialis muscle.,"Relieves brachialis tension, aids in arm muscle recovery."
Seated Glute,Beginner,Glute stretching exercise performed while seated.,"Relaxes glutes, seated position focuses on stretch."
Standing Pelvic Tilt,Beginner,Pelvic tilt exercise to improve lower back and core stability.,"Improves pelvic and core stability, tilting movement is effective."
Double-kettlebell windmill,Advanced,Full-body kettlebell exercise involving a windmill movement.,"Challenges full-body coordination, kettlebell windmill is advanced."
Lying Glute,Beginner,Glute stretching exercise performed lying down.,"Relaxes glutes, lying position aids in stretch."
Pass-through stretch with band,Beginner,Shoulder and upper back stretch using a band.,"Enhances shoulder and upper back flexibility, band adds resistance."
Lying Bent Leg Groin,Beginner,Groin stretching exercise focusing on bent leg movements.,"Increases groin flexibility, bent leg position targets muscles."
Neck-SMR,Intermediate,Self-myofascial release for the neck muscles.,"Relieves neck tension, self-myofascial release aids recovery."
Foot-SMR,Beginner,Foot myofascial release to improve foot mobility and flexibility.,"Improves foot health, myofascial release aids in mobility."
One Knee To Chest,Beginner,Hip and lower back stretch involving one knee to chest.,"Relieves hip and lower back tension, knee-to-chest stretch is effective."
Standing Elevated Quad Stretch,Beginner,Quad stretching exercise performed with an elevated leg.,"Enhances quad flexibility, elevated leg position increases intensity."
Wrist Circles,Beginner,Wrist mobility exercise involving circular movements.,"Improves wrist mobility, circular movement aids joint health."
Chair Leg Extended Stretch,Beginner,Hamstring stretching exercise using a chair for extended leg.,"Increases hamstring flexibility, chair stretch aids in leg extension."
IT Band and Glute Stretch,Intermediate,Stretch focusing on the IT band and glutes.,"Improves flexibility in the IT band and glutes, intermediate stretch."
Single-leg lying cross-over stretch,Intermediate,Single-leg stretch with a cross-over motion.,"Targets leg muscles, cross-over adds complexity."
Side-Lying Floor Stretch,Intermediate,Side-lying floor stretch targeting the back and shoulders.,"Enhances back and shoulder flexibility, side-lying position aids stretch."
Posterior Tibialis Stretch,Intermediate,Stretch focusing on the posterior tibialis muscle.,"Focuses on lower leg muscles, important for foot and ankle health."
Overhead Lat,Intermediate,Overhead lat stretch to improve shoulder flexibility.,"Increases lat flexibility, overhead position deepens stretch."
Pyramid,Advanced,Yoga pose focusing on full body stretch and balance.,"Develops balance and flexibility, pyramid pose is challenging."
Sled Drag - Harness,Advanced,Full-body exercise involving dragging a sled with a harness.,"Builds full-body strength, sled drag is a high-intensity workout."
Burpee over barbell,Advanced,Dynamic movement combining a burpee with a barbell jump.,"Combines cardio with strength, dynamic and challenging."
Medicine ball rotational throw,Advanced,Rotational throw exercise using a medicine ball.,"Improves rotational power, medicine ball adds resistance."
Medicine ball sprawl to chest press,Intermediate,Exercise combining a sprawl with a chest press using a medicine ball.,"Combines cardio and strength, requires coordination."
Bosu Ball Crunch,Intermediate,Core exercise focusing on crunches using a Bosu ball.,"Strengthens core, Bosu ball adds instability."
Dumbbell Overhead Squat,Advanced,Squat exercise performed with dumbbells held overhead.,"Challenges full body, overhead squat is demanding."
Front Squat Push Press,Advanced,Combination of a front squat and a push press.,"Combines squat with overhead press, intense full-body workout."
Single-arm half-kneeling shoulder press,Advanced,Shoulder press performed in a half-kneeling position with one arm.,"Strengthens shoulders, half-kneeling position challenges stability."
Hand Stand Push-Up,Advanced,Upper body strength exercise focusing on handstand push-ups.,"Develops upper body strength, advanced bodyweight exercise."
Weighted Push-Up,Advanced,Push-up variation using additional weight for resistance.,"Increases push-up intensity, weighted variation adds challenge."
Wall walk,Advanced,Full body exercise involving walking on hands along a wall.,"Builds full-body strength and agility, wall walk is demanding."
Dumbbell walking lunge-,Intermediate,"Lower body exercise with dumbbells, focusing on lunges.","Strengthens legs, walking lunge adds mobility element."
Suitcase crunch,Intermediate,Core exercise focusing on crunches while holding a suitcase.,"Targets core muscles, suitcase hold adds difficulty."
Seated Scissor Kick,Intermediate,Core exercise performed seated with scissor-like leg movements.,"Strengthens core, seated position challenges stability."
Sled Reverse Flye,Advanced,Upper body exercise using a sled for reverse fly movements.,"Targets upper back, sled reverse flye is challenging."
Dumbbell thruster,Advanced,Full body exercise combining a squat and press with dumbbells.,"Combines squat with overhead press, demanding full-body workout."
Thigh killa,Advanced,Intense lower body workout focusing on the thighs.,"Intense lower body exercise, focuses on thigh muscles."
Sumo Deadlift with Bands,Advanced,Deadlift variation using bands for added resistance.,"Increases deadlift difficulty, bands add variable resistance."
Partner Facing Feet-Elevated Side Plank With Band Row,Advanced,Partner exercise involving a side plank with elevated feet.,"Enhances core strength, partner exercise adds complexity."
Barbell reverse lunge,Intermediate,Leg exercise focusing on reverse lunges with a barbell.,"Strengthens legs, reverse lunge adds balance challenge."
One-Arm Kettlebell Floor Press,Intermediate,Upper body press performed on the floor with a kettlebell.,"Targets chest and arms, floor press isolates upper body."
Prone Manual Hamstring,Advanced,Hamstring strengthening exercise performed prone.,"Strengthens hamstrings, prone position focuses on leg muscles."
Suspended Leg Curl,Intermediate,Leg curl exercise using a suspension trainer.,"Targets leg muscles, suspension trainer adds instability."
Single-Leg Box Jump,Advanced,Plyometric exercise focusing on single-leg box jumps.,"Develops leg power, single-leg focus increases difficulty."
Hollow-hold ball toss,Intermediate,Core stability exercise involving a ball toss while in a hollow hold.,"Strengthens core, ball toss adds coordination challenge."
Southpaw sprawl,Advanced,Cardio exercise with a combat stance and sprawl motion.,"Improves cardio, combat stance and sprawl adds intensity."
Conan's Wheel,Advanced,Strength exercise involving lifting and carrying a heavy wheel.,"Builds strength, carrying heavy wheel challenges full body."
JM Press With Bands,Advanced,Upper body press with added resistance from bands.,"Strengthens upper body, bands add resistance to press."
Kettlebell side squat,Intermediate,Lower body exercise involving a side squat with a kettlebell.,"Targets legs, side squat focuses on lateral movement."
Single-Leg Hop Progression,Advanced,Leg coordination and balance exercise with single-leg hops.,"Improves leg coordination, single-leg hop challenges balance."
Partner resistance standing twist,Intermediate,"Core exercise with a partner, involving a standing twist.","Strengthens core, partner twist adds resistance."
Rickshaw Deadlift,Advanced,Lower body exercise focusing on a deadlift with a unique grip.,"Targets legs and back, unique deadlift grip challenges muscles."
Burpee to pull-up,Advanced,Combination exercise of a burpee and pull-up.,"Combines cardio and strength, burpee to pull-up is intense."
Return Push from Stance,Advanced,Explosive exercise involving a push from a fighting stance.,"Develops explosive power, fighting stance adds dynamic element."
Barbell pull-over to press,Advanced,Upper body exercise combining a pull-over and press with a barbell.,"Combines chest and arm strength, pull-over to press is challenging."
Stride Jump Crossover,Advanced,Agility and leg strength exercise with stride jump crossovers.,"Improves agility, stride jump crossover challenges coordination."
Typewriter push-up,Advanced,Upper body strength exercise with a typewriter push-up motion.,"Strengthens arms and chest, typewriter push-up adds difficulty."
Feet Jack,Intermediate,Cardio exercise involving jumping feet movement.,"Enhances cardio, feet jack focuses on leg movement."
Wall shoulder tap,Advanced,Upper body stability exercise with shoulder taps against a wall.,"Improves stability, shoulder tap challenges upper body."
Rack Delivery,Advanced,Full body exercise involving carrying weights on a rack.,"Builds strength, rack carry challenges endurance and balance."
Cross Crunch,Intermediate,Core exercise focusing on a cross crunch movement.,"Strengthens core, cross crunch targets obliques."
Dumbbell suitcase carry,Intermediate,Lower body exercise with a dumbbell carry mimicking a suitcase.,"Mimics functional movement, dumbbell carry builds strength."
Dumbbell front squat,Intermediate,Leg strengthening exercise with a dumbbell front squat.,"Strengthens legs, front squat focuses on quads and glutes."
